way,3,way,NOUN,NN,ROOT,True,False,2,[u'The way metrics are polled across instances ', u' PREVIEW Priority Use Low to run short lived workloads in a cost effective way']
sql,3,sql,PROPN,NNP,nmod,True,False,118,[u'Name of the Azure SQL managed instance ', u'The name of the Azure SQL Managed Database ']
row,3,row,NOUN,NN,compound,True,False,3,[u' The minimum row key accessible with this shared access signature startpk must accompany startrk Key values are inclusive If omitted there is no lower bound on the table entities that can be accessed ', u' The maximum row key accessible with this shared access signature endpk must accompany endrk Key values are inclusive If omitted there is no upper bound on the table entities that can be accessed ']
vpn,3,vpn,PROPN,NNP,compound,True,False,42,[u'VPN routing type ', u'Get the details of a VPN connection ']
dev,3,dev,PROPN,NNP,compound,True,False,9,[u' PREVIEW Remove Azure Dev Spaces from a managed Kubernetes cluster ', u'Remove Azure Dev Spaces from a managed Kubernetes cluster ']
caa,3,caa,PROPN,NNP,compound,True,False,17,[u'List all CAA record sets in a zone ', u'List all CAA record sets in a zone ']
map,3,map,NOUN,NN,pobj,True,False,45,[u'Get the details of a URL path map ', u'The name of the URL path map ']
max,3,max,PROPN,NNP,compound,True,False,27,[u'0 based logical unit number LUN Max value depends on the Virtual Machine size ', u'The max storage size If no unit is specified defaults to bytes B ']
ttl,3,ttl,PROPN,NNP,compound,True,False,13,[u'Record set TTL time to live ', u'Default TTL']
hub,3,hub,PROPN,NNP,compound,True,False,178,[u'IoT Hub name ', u'Update an Azure IoT Hub device provisioning service ']
sas,3,sas,PROPN,NNP,compound,True,False,303,[u'Storage account name Related environment variable AZURE_STORAGE_ACCOUNT Must be used in conjunction with either storage account key or a SAS token If neither are present the command will try to query the storage account key using the authenticated Azure account If a large number of storage commands are executed the API quota may be hit', u'A Shared Access Signature SAS Must be used in conjunction with storage account name Environment variable AZURE_STORAGE_SAS_TOKEN']
xml,3,xml,NOUN,NN,compound,True,False,3,[u'Enables xml output format ', u'Create a service principal with password and configure its access to an Azure Media Services account Output will be in xml format ']
ssl,3,ssl,PROPN,NNP,nmod,True,False,66,[u'Gets SSL predefined policy with the specified policy name ', u'Name of Ssl predefined policy ']
ssh,3,ssh,NOUN,NN,nmod,True,False,58,[u'The SSH public key that can be used for remote login to the compute node The public key should be compatible with OpenSSH encoding and should be base 64 encoded This property can be specified only for Linux nodes If this is specified for a Windows node then the Batch service rejects the request if you are calling the REST API directly the HTTP status code is 400 Bad Request ', u'Use CLI s old authentication flow based on device code CLI will also use this if it can t launch a browser in your behalf e g in remote SSH or Cloud Shell']
geo,3,geo,PROPN,NNP,compound,True,False,63,[u'Name of Geo Disaster Recovery Configuration Alias', u'Manage Azure Event Hubs namespaces eventhubs consumergroups and geo recovery configurations Alias']
pop,3,pop,NOUN,NN,compound,True,False,2,[u' A valid pop receipt value returned from an earlier call to the func get_messages or func update_message ', u' A valid pop receipt value returned from an earlier call to the func get_messages or func update_message operation ']
pod,3,pod,NOUN,NN,compound,True,False,3,[u'A CIDR notation IP range from which to assign pod IPs when kubenet is used ', u'The maximum number of pods deployable to a node ']
aci,3,aci,PROPN,NNP,compound,True,False,23,[u' PREVIEW Upgrade the ACI Connector on a managed Kubernetes cluster ', u'The resource group to create the ACI container groups Use the MC_ resource group if it is not specified ']
acl,3,acl,PROPN,NNP,pobj,True,False,15,[u'The name of a stored access policy within the table s ACL ', u'The name of a stored access policy within the container s ACL ']
acs,3,acs,X,FW,compound,True,False,11,[u'Name of the container service You can configure the default using az configure defaults acs name ', u'Name of the container service You can configure the default using az configure defaults acs name ']
acr,3,acr,PROPN,NNP,compound,True,False,38,[u'The name of the container registry You can configure the default registry name using az configure defaults acr registry name ', u'The name of the container registry You can configure the default registry name using az configure defaults acr registry name ']
srv,3,srv,PROPN,NNP,compound,True,False,15,[u'Get the details of an SRV record set ', u'Get the details of an SRV record set ']
lob,3,lob,NOUN,NN,attr,True,False,7,[u'The storage service s to remove rules from Allowed options are b lob f ile q ueue t able Can be combined ', u'The storage services from which to retrieve metrics info b lob q ueue t able Can be combined ']
lot,3,lot,NOUN,NN,npadvmod,True,False,1,[u'Encrypts formats data disks instead of encrypting them Encrypt formatting is a lot faster than in place encryption but wipes out the partition getting encrypt formatted '],
vhd,3,vhd,NOUN,NN,dobj,True,False,11,[u'Virtual hard disk URI For example https mystorage blob core windows net vhds d1 vhd', u'Defaults to page for vhd files or block otherwise The setting will override blob types for every file ']
ptr,3,ptr,NOUN,NN,compound,True,False,17,[u'Create an empty PTR record set ', u'Create an empty PTR record set ']
vip,3,vip,NOUN,NN,compound,True,False,1,[u'Virtual network gateway vip address supplied to the begin reset of the active active feature enabled gateway '],
der,3,der,PROPN,NNP,nsubj,True,False,2,[u'Encoding of the certificate DER will create a binary DER formatted x509 certificate and PEM will create a base64 PEM x509 certificate ', u'Encoding of the certificate DER will create a binary DER formatted x509 certificate and PEM will create a base64 PEM x509 certificate ']
des,3,des,PROPN,NNP,compound,True,False,2,[u'Required The IPSec encryption algorithm IKE phase 1 Possible values include None DES DES3 AES128 AES192 AES256 GCMAES128 GCMAES192 GCMAES256 ', u'Required The IKE encryption algorithm IKE phase 2 Possible values include DES DES3 AES128 AES192 AES256 GCMAES256 GCMAES128 ']
css,3,css,NOUN,NN,conj,True,False,2,[u'Pre load Javascript and CSS content for an endpoint ', u'Purge pre loaded Javascript and CSS content ']
cer,3,cer,NOUN,NN,compound,True,False,1,[u'The certificate file cer file or pfx file '],
ftp,3,ftp,PROPN,NNP,dobj,True,False,2,[u'Set FTP and git deployment credentials for all apps ', u'Set FTP and git deployment credentials for all apps ']
pub,3,pub,NOUN,NN,dobj,True,False,2,[u'Optional SSH public key value or path If ommited and no password specified default SSH key ssh id_rsa pub will be used ', u'Optional SSH public key value or path If ommited and no password specified default SSH key ssh id_rsa pub will be used ']
asc,3,asc,NOUN,NN,pobj,True,False,12,[u'OrderBy clause One or more comma separated expressions with an optional asc the default or desc depending on the order you d like the values sorted e g Categories orderby CategoryName desc Optional ', u'OrderBy clause One or more comma separated expressions with an optional asc the default or desc depending on the order you d like the values sorted e g Categories orderby CategoryName desc Optional ']
put,3,put,PROPN,NNP,compound,True,False,4,[u'The action the Batch service should take when all tasks in the job are in the completed state If omitted the completion behavior is set to noaction If the current value is terminatejob this is an error because a job s completion behavior may not be changed from terminatejob to noaction You may not change the value from terminatejob to noaction that is once you have engaged automatic job termination you cannot turn it off again If you try to do this the request fails and Batch returns status code 400 Bad Request and an invalid property value error response If you do not specify this element in a PUT request it is equivalent to passing noaction This is an error if the current value is terminatejob ', u'Create a device authenticating with a self signed X 509 certificate which is put into to the current directory ']
gpu,3,gpu,PROPN,NNP,compound,True,False,3,[u'Report a GPU state for a job s node ', u'VM size for cluster nodes e g Standard_NC6 for 1 GPU node ']
aad,3,aad,PROPN,NNP,compound,True,False,15,[u'Manage applications with AAD Graph ', u'The AAD tenant must provide when using service principals ']
dtu,3,dtu,NOUN,NNS,pobj,True,False,18,[u'The capacity component of the sku in integer number of DTUs or vcores ', u'The minumum capacity in DTUs or vcores each database is guaranteed ']
cdn,3,cdn,PROPN,NNP,compound,True,False,75,[u'Create a new CDN profile ', u'The pricing tier defines a CDN provider feature list and rate of the CDN profile Defaults to Standard_Akamai ']
arp,3,arp,PROPN,NNP,compound,True,False,2,[u'Show the current Address Resolution Protocol ARP table of an ExpressRoute circuit ', u'Show the current Address Resolution Protocol ARP table of an ExpressRoute circuit ']
set,3,set,NOUN,NNS,compound,True,False,1031,[u'Sets user defined metadata on the specified queue Metadata is associated with the queue as name value pairs ', u'Batch account name Alternatively set by environment variable AZURE_BATCH_ACCOUNT']
seq,3,seq,NOUN,NNS,attr,True,False,16,[u'The pattern used for globbing files or blobs in the source The supported patterns are seq and seq ', u'The pattern used for globbing files or blobs in the source The supported patterns are seq and seq ']
sec,3,sec,NOUN,NNS,advmod,True,False,5,[u'The socket timeout secs used by the service to regulate data flow ', u'The socket timeout secs used by the service to regulate data flow ']
arm,3,arm,PROPN,NNP,compound,True,False,25,[u'Get the details of an ARM template in a lab ', u'Name if within the same resource group or ARM Id of Primary Secondary eventhub namespace name which is part of GEO DR pairing']
bin,3,bin,PROPN,NNP,conj,True,False,9,[u'The command line of the Job Manager task The command line does not run under a shell and therefore cannot take advantage of shell features such as environment variable expansion If you want to take advantage of such features you should invoke the shell in the command line for example using cmd c MyCommand in Windows or bin sh c MyCommand in Linux If the command line refers to file paths it should use a relative path relative to the task working directory or use the Batch provided environment variable https docs microsoft com en us azure batch batch compute node environment variables ', u'The command line of the Job Manager task The command line does not run under a shell and therefore cannot take advantage of shell features such as environment variable expansion If you want to take advantage of such features you should invoke the shell in the command line for example using cmd c MyCommand in Windows or bin sh c MyCommand in Linux If the command line refers to file paths it should use a relative path relative to the task working directory or use the Batch provided environment variable https docs microsoft com en us azure batch batch compute node environment variables ']
pep,3,pep,PROPN,NNP,pobj,True,False,2,[u'Space separated list of extra URLs of package indexes to use This should point to a repository compliant with PEP 503 the simple repository API or a local directory laid out in the same format ', u'Space separated list of extra URLs of package indexes to use This should point to a repository compliant with PEP 503 the simple repository API or a local directory laid out in the same format ']
pem,3,pem,NOUN,NN,compound,True,False,12,[u'Import a private key Supports importing base64 encoded private keys from PEM files Supports importing BYOK keys into HSM for premium KeyVaults ', u'Password of PEM file ']
ids,3,ids,X,FW,pobj,True,False,7,[u'Space separated list of IDs ex 1 2 3 or for all instances ', u'Space separated list of IDs ex 1 2 3 or for all instances If not provided the action will be applied on the scaleset itself']
bgp,3,bgp,NOUN,NN,compound,True,False,31,[u'Autonomous System Number to use for the BGP settings ', u'Weight 0 100 added to routes learned through BGP peering ']
nsg,3,nsg,PROPN,NNP,compound,True,False,19,[u'Create a basic Allow NSG rule with the highest priority ', u'Manage Azure Network Security Groups NSGs ']
sdk,3,sdk,NOUN,NN,compound,True,False,2,[u'output result in compatible with Azure SDK auth file', u'output result in compatible with Azure SDK auth file']
utc,3,utc,NOUN,NN,compound,True,False,127,[u'Filter results based on UTC hour offset ', u'Alter only if unmodified since supplied UTC datetime Y m d T H M Z ']
nat,3,nat,PROPN,NNP,compound,True,False,49,[u'List inbound NAT rules ', u'List inbound NAT rules ']
rdp,3,rdp,PROPN,NNP,compound,True,False,2,[u'Gets the Remote Desktop Protocol file for the specified compute node Before you can access a node by using the RDP file you must create a user account on the node This API can only be invoked on pools created with a cloud service configuration For pools created with a virtual machine configuration see the GetRemoteLoginSettings API ', u'NSG rule to create when creating a new NSG Defaults to open ports for allowing RDP on Windows and allowing SSH on Linux ']
app,3,app,NOUN,NN,pobj,True,False,188,[u'List backups of a web app ', u'The app name or app URI to associate the RBAC with If not present a default name like amsaccountname access sp will be generated ']
api,3,api,NOUN,NN,compound,True,False,201,[u'Storage account name Related environment variable AZURE_STORAGE_ACCOUNT Must be used in conjunction with either storage account key or a SAS token If neither are present the command will try to query the storage account key using the authenticated Azure account If a large number of storage commands are executed the API quota may be hit', u'Storage account name Related environment variable AZURE_STORAGE_ACCOUNT Must be used in conjunction with either storage account key or a SAS token If neither are present the command will try to query the storage account key using the authenticated Azure account If a large number of storage commands are executed the API quota may be hit']
zip,3,zip,NOUN,NN,compound,True,False,9,[u'Perform deployment using the kudu zip push deployment for a webapp ', u'a zip file path for deployment']
pfs,3,pfs,PROPN,NNP,compound,True,False,1,[u'Required The Pfs Groups used in IKE Phase 2 for new child SA Possible values include None PFS1 PFS2 PFS2048 ECP256 ECP384 PFS24 PFS14 PFSMM '],
tag,3,tag,NOUN,NNS,dobj,True,False,290,[u'space separated tags in key value format Use to clear existing tags ', u'space separated tags in key value format Use to clear existing tags ']
vms,3,vms,PROPN,NNP,compound,True,False,6,[u'Feature in preview only in canadacentral canadaeast centralindia koreasouth koreacentral southindia uksouth ukwest westcentralus westindia westus2 The disk size for master pool vms Unit in GB Default corresponding vmsize disk size', u'Feature in preview only in canadacentral canadaeast centralindia koreasouth koreacentral southindia uksouth ukwest westcentralus westindia westus2 Set the default disk size for agent pools vms Unit in GB Default corresponding vmsize disk size']
day,3,day,NOUN,NN,pobj,True,False,50,[u'Get policy events at current subscription scope created in the last day ', u'Number of days that soft deleted blob will be retained Must be in range 1 365 ']
hls,3,hls,PROPN,NNP,compound,True,False,1,[u'Enable HLS protocol '],
val,3,val,PROPN,NNP,compound,True,False,3,[u'Space separated list of IP tags in TYPE VAL format ', u'Space separated list of IP tags in TYPE VAL format ']
rsa,3,rsa,NOUN,NN,compound,True,False,3,[u'Public key path or key contents to install on node VMs for SSH access For example ssh rsa AAAAB snip UcyupgH azureuser linuxvm ', u'Configure all linux machines with the SSH RSA public key string Your key should include three parts for example ssh rsa AAAAB snip UcyupgH azureuser linuxvm']
min,3,min,NOUN,NN,compound,True,False,8,[u'The numer of instances to use If used with min max count the default number of instances to use ', u'The numer of instances to use If used with min max count the default number of instances to use ']
urn,3,urn,NOUN,NN,nsubj,True,False,10,[u'URN in format of publisher offer sku versin If specified other argument values can be omitted', u'URN in format of publisher offer sku versin If specified other argument values can be omitted']
uri,3,uri,NOUN,NN,conj,True,False,67,[u'JSON formatted string or a path to a file or uri with parameter definitions', u'Virtual hard disk URI For example https mystorage blob core windows net vhds d1 vhd']
dps,3,dps,PROPN,NNP,compound,True,False,4,[u'A friendly name for DPS access policy ', u'A friendly name for DPS access policy ']
lun,3,lun,PROPN,NNP,compound,True,False,9,[u'0 based logical unit number LUN Max value depends on the Virtual Machine size ', u'0 based logical unit number LUN Max value depends on the Virtual Machine instance size ']
job,3,job,NOUN,NN,dobj,True,False,451,[u'Add a job to a Batch account ', u'The maximum elapsed time that the job may run measured from the time the job is created If the job does not complete within the time limit the Batch service terminates it and any tasks that are still running In this case the termination reason will be MaxWallClockTimeExpiry If this property is not specified there is no time limit on how long the job may run Expected format is an ISO 8601 duration ']
key,3,key,NOUN,NN,pobj,True,False,1410,[u'Storage account name Related environment variable AZURE_STORAGE_ACCOUNT Must be used in conjunction with either storage account key or a SAS token If neither are present the command will try to query the storage account key using the authenticated Azure account If a large number of storage commands are executed the API quota may be hit', u'Storage account name Related environment variable AZURE_STORAGE_ACCOUNT Must be used in conjunction with either storage account key or a SAS token If neither are present the command will try to query the storage account key using the authenticated Azure account If a large number of storage commands are executed the API quota may be hit']
tls,3,tls,PROPN,NNP,pobj,True,False,1,[u'The minimum version of TLS required for SSL requests e g 1 0 1 1 1 2 '],
etc,3,etc,X,FW,ROOT,True,False,17,[u'The pricing tiers e g F1 Free D1 Shared B1 Basic Small B2 Basic Medium B3 Basic Large S1 Standard Small P1 Premium Small P1V2 Premium V2 Small etc', u'The pricing tiers e g F1 Free D1 Shared B1 Basic Small B2 Basic Medium B3 Basic Large S1 Standard Small P1 Premium Small P1V2 Premium V2 Small etc']
ike,3,ike,PROPN,NNP,compound,True,False,8,[u'Required The Pfs Groups used in IKE Phase 2 for new child SA Possible values include None PFS1 PFS2 PFS2048 ECP256 ECP384 PFS24 PFS14 PFSMM ', u'Required The IPSec encryption algorithm IKE phase 1 Possible values include None DES DES3 AES128 AES192 AES256 GCMAES128 GCMAES192 GCMAES256 ']
tsv,3,tsv,X,XX,dobj,True,False,2,[u'Space separated list of key vault secret URIs Perhaps produced by az keyvault secret list versions vault name vaultname n cert1 query attributes enabled id o tsv ', u'Export a DNS zone as a DNS zone file in tsv format ']
mya,3,mya,PROPN,NNP,nmod,True,False,19,[u'The parent path Ex resA myA resB myB ', u'The parent path Ex resA myA resB myB ']
iot,3,iot,PROPN,NNP,ROOT,True,False,180,[u'IoT Hub name ', u'Update an Azure IoT Hub device provisioning service ']
php,3,php,PROPN,NNP,pobj,True,False,3,[u'canonicalized web runtime in the format of Framework Version e g PHP 5 6 Use az webapp list runtimes for available list', u'The version used to run your web app if using PHP e g 5 5 5 6 7 0']
tcp,3,tcp,PROPN,NNP,nmod,True,False,2,[u'Specifies that connections to the given TCP port or Unix socket on the local client host are to be forwarded to the given host and port or Unix socket on the remote side e g L 8080 localhost 8080', u'Specifies that connections to the given TCP port or Unix socket on the local client host are to be forwarded to the given host and port or Unix socket on the remote side e g L 8080 localhost 8080']
sku,3,sku,NOUN,NNS,pobj,True,False,114,[u'Gets a list of SKUs available for your VM scale set including the minimum and maximum VM instances allowed for each SKU ', u'Gets a list of SKUs available for your VM scale set including the minimum and maximum VM instances allowed for each SKU ']
web,3,web,NOUN,NN,compound,True,False,211,[u'List backups of a web app ', u'name of the web You can configure the default using az configure defaults web name ']
var,3,var,NOUN,NN,compound,True,False,1,[u'Local path on the targeted VM at which to save the packet capture For Linux VMs the path must start with var captures '],
bus,3,bus,PROPN,NNP,compound,True,False,101,[u'Create Authorization Rule for given Service Bus Topic', u'Create Authorization Rule for given Service Bus Topic']
ead,3,ead,NOUN,NN,compound,True,False,15,[u'The permissions the SAS grants Allowed values r ead query a dd u pdate d elete Do not use if a stored access policy is referenced with id that specifies this value Can be combined ', u'The permissions the SAS grants Allowed values c reate d elete r ead w rite Do not use if a stored access policy is referenced with id that specifies this value Can be combined ']
eap,3,eap,PROPN,NNP,compound,True,False,1,[u'Create the VPN client configuration for RADIUS with EAP MSCHAV2 authentication '],
dms,3,dms,PROPN,NNP,compound,True,False,11,[u'Place the CLI in a waiting state until a condition of the DMS instance is met ', u'Check if a given Project name is available within a given instance of DMS as well as the name s validity ']
pip,3,pip,NOUN,NN,pobj,True,False,2,[u'Proxy for pip to use for extension dependencies in the form of user passwd proxy server port', u'Proxy for pip to use for extension dependencies in the form of user passwd proxy server port']
cpu,3,cpu,NOUN,NN,compound,True,False,10,[u'Value for low CPU threshold ', u'Update low CPU threshold for a given subscription to 20 ']
swap,4,swap,NOUN,NN,dobj,True,False,9,[u'Configure deployment slot auto swap ', u'target slot to auto swap']
isvs,4,isvs,PROPN,NNP,pobj,True,False,1,[u'Manage template solutions provided and maintained by Independent Software Vendors ISVs '],
kudu,4,kudu,NOUN,NN,amod,True,False,3,[u'Perform deployment using the kudu zip push deployment for a webapp ', u'By default all live traces configured by az webapp log config will be shown but you can scope to certain providers folders e g application http etc For details check out https github com projectkudu kudu wiki Diagnostic Log Stream']
msdn,4,msdn,NOUN,NN,compound,True,False,1,[u' Returns only entities that satisfy the specified filter Note that no more than 15 discrete comparisons are permitted within a filter string See http msdn microsoft com en us library windowsazure dd894031 aspx for more information on constructing filters '],
vhds,4,vhds,NOUN,NN,compound,True,False,1,[u'Virtual hard disk URI For example https mystorage blob core windows net vhds d1 vhd'],
path,4,path,NOUN,NNS,dobj,True,False,471,[u'The command line of the Job Manager task The command line does not run under a shell and therefore cannot take advantage of shell features such as environment variable expansion If you want to take advantage of such features you should invoke the shell in the command line for example using cmd c MyCommand in Windows or bin sh c MyCommand in Linux If the command line refers to file paths it should use a relative path relative to the task working directory or use the Batch provided environment variable https docs microsoft com en us azure batch batch compute node environment variables ', u'The command line of the Job Manager task The command line does not run under a shell and therefore cannot take advantage of shell features such as environment variable expansion If you want to take advantage of such features you should invoke the shell in the command line for example using cmd c MyCommand in Windows or bin sh c MyCommand in Linux If the command line refers to file paths it should use a relative path relative to the task working directory or use the Batch provided environment variable https docs microsoft com en us azure batch batch compute node environment variables ']
unix,4,unix,PROPN,NNP,conj,True,False,4,[u'Specifies that connections to the given TCP port or Unix socket on the local client host are to be forwarded to the given host and port or Unix socket on the remote side e g L 8080 localhost 8080', u'Specifies that connections to the given TCP port or Unix socket on the local client host are to be forwarded to the given host and port or Unix socket on the remote side e g L 8080 localhost 8080']
unit,4,unit,NOUN,NN,compound,True,False,25,[u'0 based logical unit number LUN Max value depends on the Virtual Machine size ', u'Number of message units This property is only applicable to namespaces of Premium SKU']
call,4,call,NOUN,NN,pobj,True,False,138,[u'Request timeout in seconds Applies to each call to the service ', u'Request timeout in seconds Applies to each call to the service ']
type,4,type,NOUN,NN,ROOT,True,False,279,[u'Resource type Ex resC ', u'Resource type Ex resC ']
