text,length, lemma_, pos_, tag_, dep_, is_alpha, is_stop, count, samples,
mc,2,mc,PROPN,NNP,compound,True,False,4,[u'The resource group to create the ACI container groups Use the MC_ resource group if it is not specified ', u'The location to create the ACI container groups Use the location of the MC_ resource group if it is not specified ']
mb,2,mb,NOUN,NN,appos,True,False,10,[u'If compression is enabled content will be served as compressed if user requests for a compressed version Content won t be compressed on CDN when requested content is smaller than 1 byte or larger than 1 MB ', u'If compression is enabled content will be served as compressed if user requests for a compressed version Content won t be compressed on CDN when requested content is smaller than 1 byte or larger than 1 MB ']
mm,2,mm,PROPN,NNP,compound,True,False,13,[u'End date YYYY MM DD in UTC Only needed for daily grain and if specified also requires start date ', u'Start date YYYY MM DD in UTC Only needed for daily grain and if specified also requires end date ']
mi,2,mi,NOUN,NN,dobj,True,False,1,[u'Updates a mi with specified parameters and with identity'],
dh,2,dh,PROPN,NNP,compound,True,False,1,[u'Required The DH Groups used in IKE Phase 1 for initial SA Possible values include None DHGroup1 DHGroup2 DHGroup14 DHGroup2048 ECP256 ECP384 DHGroup24 '],
dd,2,dd,NOUN,NN,aux,True,False,18,[u'The permissions the SAS grants Allowed values r ead query a dd u pdate d elete Do not use if a stored access policy is referenced with id that specifies this value Can be combined ', u'The permissions the SAS grants Allowed values a dd p rocess r ead u pdate Do not use if a stored access policy is referenced with id that specifies this value Can be combined ']
db,2,db,PROPN,NNP,compound,True,False,77,[u'Updates an Azure Cosmos DB collection ', u'Cosmos DB account url connection Must be used in conjunction with cosmosdb account key ']
dc,2,dc,PROPN,NNP,compound,True,False,3,[u'Download and install the DC OS command line tool for a cluster ', u'Creates an SSH tunnel to the Azure container service and opens the Mesosphere DC OS dashboard in the browser ']
dt,2,dt,PROPN,NNP,compound,True,False,2,[u'The end time of the query in the format of Y m dT H M SZ e g 2000 12 31T12 59 59Z Defaults to the current time', u'The start time of the query in the format of Y m dT H M SZ e g 2000 12 31T12 59 59Z Defaults to 1 Hour prior to the current time']
dr,2,dr,PROPN,NNP,compound,True,False,3,[u'Name if within the same resource group or ARM Id of Primary Secondary eventhub namespace name which is part of GEO DR pairing', u'Invokes GEO DR failover and reconfigure the alias to point to the secondary namespace']
ip,2,ip,PROPN,NNP,compound,True,False,275,[u'Check if a private IP address is available for use within a virtual network ', u'The private IP address to be verified ']
id,2,id,NOUN,NNS,compound,True,False,1148,[u'One or more resource IDs space delimited If provided no other Resource Id arguments should be specified ', u'A string that uniquely identifies the job within the account The ID can contain any combination of alphanumeric characters including hyphens and underscores and cannot contain more than 64 characters The ID is case preserving and case insensitive that is you may not have two IDs within an account that differ only by case ']
ne,2,ne,NOUN,NN,dobj,True,False,1,[u'May be used to filter billing periods by billingPeriodEndDate The filter supports eq lt gt le ge and and It does not currently support ne or or not '],
ns,2,ns,PROPN,NNP,compound,True,False,15,[u'Create an empty NS record set ', u'Create an empty NS record set ']
ms,2,ms,NOUN,NN,compound,True,False,2,[u'Create a security rule using service tags For more details visit https aka ms servicetags', u'The runtime stack used for your linux based webapp e g RUBY 2 3 NODE 6 6 PHP 5 6 DOTNETCORE 1 1 0 See https aka ms linux stacks for more info ']
mx,2,mx,PROPN,NNP,compound,True,False,15,[u'Remove an MX record from its record set ', u'Remove an MX record from its record set ']
sz,2,sz,PROPN,NNP,compound,True,False,2,[u'The end time of the query in the format of Y m dT H M SZ e g 2000 12 31T12 59 59Z Defaults to the current time', u'The start time of the query in the format of Y m dT H M SZ e g 2000 12 31T12 59 59Z Defaults to 1 Hour prior to the current time']
ss,2,ss,PROPN,NNP,appos,True,False,1,[u'The point in time of the source database that will be restored to create the new database Must be greater than or equal to the source database s earliestRestoreDate value Time should be in following format YYYY MM DDTHH MM SS '],
sh,2,sh,X,XX,compound,True,False,9,[u'The command line of the Job Manager task The command line does not run under a shell and therefore cannot take advantage of shell features such as environment variable expansion If you want to take advantage of such features you should invoke the shell in the command line for example using cmd c MyCommand in Windows or bin sh c MyCommand in Linux If the command line refers to file paths it should use a relative path relative to the task working directory or use the Batch provided environment variable https docs microsoft com en us azure batch batch compute node environment variables ', u'The command line of the Job Manager task The command line does not run under a shell and therefore cannot take advantage of shell features such as environment variable expansion If you want to take advantage of such features you should invoke the shell in the command line for example using cmd c MyCommand in Windows or bin sh c MyCommand in Linux If the command line refers to file paths it should use a relative path relative to the task working directory or use the Batch provided environment variable https docs microsoft com en us azure batch batch compute node environment variables ']
sa,2,sa,PROPN,NNP,compound,True,False,4,[u'Required The Pfs Groups used in IKE Phase 2 for new child SA Possible values include None PFS1 PFS2 PFS2048 ECP256 ECP384 PFS24 PFS14 PFSMM ', u'Required The IPSec Security Association also called Quick Mode or Phase 2 SA lifetime in seconds for a site to site VPN tunnel ']
en,2,en,ADP,IN,advmod,True,False,25,[u'The command line of the Job Manager task The command line does not run under a shell and therefore cannot take advantage of shell features such as environment variable expansion If you want to take advantage of such features you should invoke the shell in the command line for example using cmd c MyCommand in Windows or bin sh c MyCommand in Linux If the command line refers to file paths it should use a relative path relative to the task working directory or use the Batch provided environment variable https docs microsoft com en us azure batch batch compute node environment variables ', u'The formula for the desired number of compute nodes in the pool The formula is validated and its results calculated but it is not applied to the pool To apply the formula to the pool Enable automatic scaling on a pool For more information about specifying this formula see Automatically scale compute nodes in an Azure Batch pool https azure microsoft com en us documentation articles batch automatic scaling ']
eg,2,eg,ADP,IN,prep,True,False,2,[u'A string used to reduce the set of metric data returned eg BlobType eq ', u'The interval of the metric query In ISO 8601 duration format eg PT1M ']
ex,2,ex,PROPN,NNP,compound,True,False,111,[u'Provider namespace Ex Microsoft Provider ', u'The parent path Ex resA myA resB myB ']
eu,2,eu,PROPN,NNP,nmod,True,False,1,[u'Requests that a backup of the specified key be downloaded to the client The Key Backup operation exports a key from Azure Key Vault in a protected form Note that this operation does NOT return key material in a form that can be used outside the Azure Key Vault system the returned key material is either protected to a Azure Key Vault HSM or to Azure Key Vault itself The intent of this operation is to allow a client to GENERATE a key in one Azure Key Vault instance BACKUP the key and then RESTORE it into another Azure Key Vault instance The BACKUP operation may be used to export in protected form any key type from Azure Key Vault Individual versions of a key cannot be backed up BACKUP RESTORE can be performed within geographical boundaries only meaning that a BACKUP from one geographical area cannot be restored to another geographical area For example a backup from the US geographical area cannot be restored in an EU geographical area '],
eq,2,eq,NOUN,NN,nmod,True,False,3,[u'May be used to filter billing periods by billingPeriodEndDate The filter supports eq lt gt le ge and and It does not currently support ne or or not ', u'The filter to apply on the operation For example you can use filter provisioningState eq state ']
js,2,js,NOUN,NN,compound,True,False,1,[u'The startup file for linux hosted web apps e g process json for Node js web'],
ca,2,ca,PROPN,NNP,compound,True,False,4,[u'Update a CA certificate in an Azure IoT Hub device provisioning service by uploading a new PEM file ', u'Uploads a CA certificate PEM file to an IoT hub ']
on,2,on,ADP,IN,prep,True,False,537,[u'Sets user defined metadata on the specified queue Metadata is associated with the queue as name value pairs ', u'The maximum elapsed time that the job may run measured from the time the job is created If the job does not complete within the time limit the Batch service terminates it and any tasks that are still running In this case the termination reason will be MaxWallClockTimeExpiry If this property is not specified there is no time limit on how long the job may run Expected format is an ISO 8601 duration ']
of,2,of,ADP,IN,prep,True,False,5934,[u'Name of resource group You can configure the default group using az configure defaults group name ', u'Storage account name Related environment variable AZURE_STORAGE_ACCOUNT Must be used in conjunction with either storage account key or a SAS token If neither are present the command will try to query the storage account key using the authenticated Azure account If a large number of storage commands are executed the API quota may be hit']
os,2,os,X,FW,prep,True,False,42,[u'enable disable disk write accelerator Use singular value true false to apply across or specify individual disks e g os true 1 true 2 true for os disk and data disks with lun of 1 2', u'enable disable disk write accelerator Use singular value true false to apply across or specify individual disks e g os true 1 true 2 true for os disk and data disks with lun of 1 2']
or,2,or,CCONJ,CC,cc,True,False,2067,[u'Storage account name Related environment variable AZURE_STORAGE_ACCOUNT Must be used in conjunction with either storage account key or a SAS token If neither are present the command will try to query the storage account key using the authenticated Azure account If a large number of storage commands are executed the API quota may be hit', u'One or more resource IDs space delimited If provided no other Resource Id arguments should be specified ']
ad,2,ad,NOUN,NN,compound,True,False,14,[u'The unique ID of the Azure AD administrator ', u'Display name of the Azure AD administrator user or group ']
ai,2,ai,PROPN,NNP,compound,True,False,5,[u'Manage Batch AI resources ', u'ARM ID of a virtual network subnet to put the file server in If not provided via command line or in the configuration file Batch AI will create a new virtual network and subnet under your subscription ']
ak,2,ak,NOUN,NNS,compound,True,False,1,[u'Number of nodes in the Kubernetes node pool After creating a cluster you can change the size of its node pool with az aks scale '],
as,2,as,ADP,IN,prep,True,False,202,[u'Sets user defined metadata on the specified queue Metadata is associated with the queue as name value pairs ', u'The command line of the Job Manager task The command line does not run under a shell and therefore cannot take advantage of shell features such as environment variable expansion If you want to take advantage of such features you should invoke the shell in the command line for example using cmd c MyCommand in Windows or bin sh c MyCommand in Linux If the command line refers to file paths it should use a relative path relative to the task working directory or use the Batch provided environment variable https docs microsoft com en us azure batch batch compute node environment variables ']
at,2,at,ADP,IN,prep,True,False,118,[u'Get policy events at current subscription scope created in the last day ', u'Get policy events at resource group scope in current subscription ']
az,2,az,PROPN,NNP,dobj,True,False,1505,[u'Name of resource group You can configure the default group using az configure defaults group name ', u'Name of resource group You can configure the default group using az configure defaults group name ']
gt,2,gt,X,FW,nmod,True,False,1,[u'May be used to filter billing periods by billingPeriodEndDate The filter supports eq lt gt le ge and and It does not currently support ne or or not '],
tb,2,tb,PROPN,NNP,compound,True,False,3,[u' Specifies the maximum size of the share in gigabytes Must be greater than 0 and less than or equal to 5TB 5120 ', u' Specifies the maximum size of the share in gigabytes Must be greater than 0 and less than or equal to 5 TB 5120 GB ']
vm,2,vm,PROPN,NNP,pobj,True,False,321,[u'Get the details of a VM ', u'The name of the Virtual Machine You can configure the default using az configure defaults vm name ']
kb,2,kb,PROPN,NNP,pobj,True,False,6,[u' A URL of up to 2 KB in length that specifies an Azure file or blob The value should be URL encoded as it would appear in a request URI If the source is in another account the source must either be public or must be authenticated via a shared access signature If the source is public no authentication is required Examples https myaccount file core windows net myshare mydir myfile https otheraccount file core windows net myshare mydir myfile sastoken', u'Message content up to 64KB in size ']
by,2,by,ADP,IN,prep,True,False,677,[u'A string that uniquely identifies the job within the account The ID can contain any combination of alphanumeric characters including hyphens and underscores and cannot contain more than 64 characters The ID is case preserving and case insensitive that is you may not have two IDs within an account that differ only by case ', u'Batch account name Alternatively set by environment variable AZURE_BATCH_ACCOUNT']
us,2,us,PROPN,NNP,compound,True,False,19,[u'List all publishers in the West US region ', u'List the provisioned network resources in East US region within a subscription ']
ui,2,ui,NOUN,NN,compound,True,False,2,[u'the managed application definition create ui definition', u'Launch a proxy and browse the Kubernetes web UI ']
ge,2,ge,X,FW,dobj,True,False,1,[u'May be used to filter billing periods by billingPeriodEndDate The filter supports eq lt gt le ge and and It does not currently support ne or or not '],
gb,2,gb,PROPN,NNP,nmod,True,False,21,[u'Attach a new default sized 1023 GB unmanaged data disk to a VM ', u'size in GB ']
le,2,le,X,FW,compound,True,False,1,[u'May be used to filter billing periods by billingPeriodEndDate The filter supports eq lt gt le ge and and It does not currently support ne or or not '],
lb,2,lb,ADP,IN,nummod,True,False,6,[u'Space separated list of names or IDs of load balancer address pools to associate with the NIC If names are used lb name must be specified ', u'Space separated list of names or IDs of load balancer inbound NAT rules to associate with the NIC If names are used lb name must be specified ']
lt,2,lt,X,FW,nmod,True,False,1,[u'May be used to filter billing periods by billingPeriodEndDate The filter supports eq lt gt le ge and and It does not currently support ne or or not '],
sp,2,sp,NOUN,NN,pobj,True,False,2,[u'The app name or app URI to associate the RBAC with If not present a default name like amsaccountname access sp will be generated ', u'The app name or app URI to associate the RBAC with If not present a default name like amsaccountname access sp will be generated ']
co,2,co,PROPN,NNP,compound,True,False,3,[u'Send email to subscription co administrators on scaling ', u'list default role assignments for subscription classic administrators aka co admins']
vs,2,vs,ADP,IN,aux,True,False,2,[u'custom roles only vs build in ones ', u'custom roles only vs build in ones ']
ha,2,ha,PROPN,NNP,compound,True,False,1,[u'Create an HA ports load balancing rule that assigns a frontend IP and port to use all available backend IPs in a pool on the same port '],
upn,3,upn,PROPN,NNP,nmod,True,False,7,[u' The ACL specification to set on the path in the format default user group other entity id or UPN r w x default user group other entity id or UPN r w x ', u' The ACL specification to set on the path in the format default user group other entity id or UPN r w x default user group other entity id or UPN r w x ']
cmd,3,cmd,NOUN,NN,compound,True,False,8,[u'The command line of the Job Manager task The command line does not run under a shell and therefore cannot take advantage of shell features such as environment variable expansion If you want to take advantage of such features you should invoke the shell in the command line for example using cmd c MyCommand in Windows or bin sh c MyCommand in Linux If the command line refers to file paths it should use a relative path relative to the task working directory or use the Batch provided environment variable https docs microsoft com en us azure batch batch compute node environment variables ', u'The command line of the Job Manager task The command line does not run under a shell and therefore cannot take advantage of shell features such as environment variable expansion If you want to take advantage of such features you should invoke the shell in the command line for example using cmd c MyCommand in Windows or bin sh c MyCommand in Linux If the command line refers to file paths it should use a relative path relative to the task working directory or use the Batch provided environment variable https docs microsoft com en us azure batch batch compute node environment variables ']
aka,3,aka,ADP,IN,prep,True,False,15,[u'Create a security rule using service tags For more details visit https aka ms servicetags', u'the resource namespace aka provider ']
txt,3,txt,PROPN,NNP,compound,True,False,31,[u'Create an empty TXT record set ', u'Create an empty TXT record set ']
dns,3,dns,NOUN,NN,compound,True,False,110,[u'Manage a server s DNS aliases ', u'Space separated list of DNS server IP addresses ']
nfs,3,nfs,PROPN,NNP,compound,True,False,8,[u'Optional password for the admin user created on the NFS node ', u'Name of admin user account to be created on NFS node If the value is not provided and no user configuration is provided in the config file current user s name will be used ']
end,3,end,NOUN,NN,compound,True,False,54,[u'ISO 8601 formatted timestamp specifying the end time of the interval to query ', u'ISO 8601 formatted timestamp specifying the end time of the interval to query ']
lab,3,lab,NOUN,NN,pobj,True,False,78,[u'Manage secrets of an Azure DevTest Lab ', u'Manage DevTest Lab artifact sources ']
cli,3,cli,PROPN,NNP,dobj,True,False,27,[u'Place the CLI in a waiting state until a deployment condition is met ', u'Place the CLI in a waiting state until a condition of the ExpressRoute is met ']
asg,3,asg,NOUN,NNS,dobj,True,False,1,[u'Manage application security groups ASGs '],
smb,3,smb,PROPN,NNP,nmod,True,False,2,[u'Upload a file to a share that uses the SMB 3 0 protocol ', u'Manage file shares that use the SMB 3 0 protocol ']
ist,3,ist,X,FW,npadvmod,True,False,6,[u'Allowed values d elete l ist r ead w rite Can be combined', u'Allowed values d elete l ist r ead w rite Can be combined']
iso,3,iso,NOUN,NN,nmod,True,False,57,[u'The maximum elapsed time that the job may run measured from the time the job is created If the job does not complete within the time limit the Batch service terminates it and any tasks that are still running In this case the termination reason will be MaxWallClockTimeExpiry If this property is not specified there is no time limit on how long the job may run Expected format is an ISO 8601 duration ', u'ISO 8601 formatted timestamp specifying the start time of the interval to query ']
udp,3,udp,PROPN,NNP,advcl,True,False,1,[u'Update a load balancing rule to change the protocol to UDP '],
don,3,don,PROPN,NNP,compound,True,False,2,[u'Don t launch a web browser after establishing port forwarding ', u'Don t add permissions for the current user service principal in the new vault ']
doc,3,doc,NOUN,NNS,dobj,True,False,20,[u'The command line of the Job Manager task The command line does not run under a shell and therefore cannot take advantage of shell features such as environment variable expansion If you want to take advantage of such features you should invoke the shell in the command line for example using cmd c MyCommand in Windows or bin sh c MyCommand in Linux If the command line refers to file paths it should use a relative path relative to the task working directory or use the Batch provided environment variable https docs microsoft com en us azure batch batch compute node environment variables ', u'An OData filter clause For more information on constructing this filter see https docs microsoft com en us rest api batchservice odata filters in batch list pools ']
doe,3,doe,X,FW,compound,True,False,1,[u'user principal name e g john doe contoso com'],
dop,3,dop,NOUN,NN,nsubjpass,True,False,4,[u'The minimum priority allowed per job for this policy At least one of min priority per job and max dop per job must be specified ', u'The maximum degree of parallelism allowed per job for this policy At least one of min priority per job and max dop per job must be specified ']
sum,3,sum,NOUN,NN,dobj,True,False,1,[u'The aggregation to use for sorting results and the direction of the sort Only one order can be specified Examples sum asc '],
bar,3,bar,NOUN,NN,pobj,True,False,6,[u'Space separated list of paths to associate with the rule Valid paths start and end with ex bar ', u'Space separated list of paths to associate with the rule Valid paths start and end with ex bar ']
ile,3,ile,NOUN,NN,nmod,True,False,3,[u'The storage service s to remove rules from Allowed options are b lob f ile q ueue t able Can be combined ', u'The storage service s to add rules to Allowed options are b lob f ile q ueue t able Can be combined ']
com,3,com,NOUN,NN,ROOT,True,False,42,[u'The command line of the Job Manager task The command line does not run under a shell and therefore cannot take advantage of shell features such as environment variable expansion If you want to take advantage of such features you should invoke the shell in the command line for example using cmd c MyCommand in Windows or bin sh c MyCommand in Linux If the command line refers to file paths it should use a relative path relative to the task working directory or use the Batch provided environment variable https docs microsoft com en us azure batch batch compute node environment variables ', u'The formula for the desired number of compute nodes in the pool The formula is validated and its results calculated but it is not applied to the pool To apply the formula to the pool Enable automatic scaling on a pool For more information about specifying this formula see Automatically scale compute nodes in an Azure Batch pool https azure microsoft com en us documentation articles batch automatic scaling ']
col,3,col,NOUN,NN,compound,True,False,1,[u'The col size for the command output'],
nic,3,nic,PROPN,NNP,appos,True,False,60,[u'The network interface NIC ', u'Get the internal domain name suffix of a NIC ']
bit,3,bit,NOUN,NNS,compound,True,False,1,[u'use 32 bits worker process or not'],
www,3,www,NOUN,NN,compound,True,False,1,[u'Endpoint origin specified by the following space delimited 3 tuple www example com http_port https_port The HTTP and HTTPsports are optional and will default to 80 and 443 respectively '],
foo,3,foo,NOUN,NN,compound,True,False,16,[u'repository url to pull the latest source from e g https github com foo foo web', u'repository url to pull the latest source from e g https github com foo foo web']
hsm,3,hsm,PROPN,NNP,pobj,True,False,2,[u'Import a private key Supports importing base64 encoded private keys from PEM files Supports importing BYOK keys into HSM for premium KeyVaults ', u'Requests that a backup of the specified key be downloaded to the client The Key Backup operation exports a key from Azure Key Vault in a protected form Note that this operation does NOT return key material in a form that can be used outside the Azure Key Vault system the returned key material is either protected to a Azure Key Vault HSM or to Azure Key Vault itself The intent of this operation is to allow a client to GENERATE a key in one Azure Key Vault instance BACKUP the key and then RESTORE it into another Azure Key Vault instance The BACKUP operation may be used to export in protected form any key type from Azure Key Vault Individual versions of a key cannot be backed up BACKUP RESTORE can be performed within geographical boundaries only meaning that a BACKUP from one geographical area cannot be restored to another geographical area For example a backup from the US geographical area cannot be restored in an EU geographical area ']
soa,3,soa,PROPN,NNP,compound,True,False,5,[u'Update properties of an SOA record ', u'Update properties of an SOA record ']
git,3,git,PROPN,NNP,compound,True,False,25,[u'Git access token required for auto sync', u'Manage build definitions which can be triggered by git commits or base image updates ']
waf,3,waf,PROPN,NNP,dobj,True,False,2,[u'Configure WAF on an application gateway in detection mode with default values', u'Get information on available WAF rule sets rule groups and rule IDs ']
